{
  "profile_name": "mercedes_w906_sprinter_om642",
  "oem": "Mercedes-Benz",
  "chassis": "W906 (Sprinter NCV3)",
  "gateway_type": "CGW",
  "default_bitrate": 500000,
  "modules": {
    "EGS53": {
      "name": "Electronic Transmission Control (722.6 Updated)",
      "tx_id": "0x7E1",
      "rx_id": "0x7E9",
      "protocol": "KWP2000",
      "seed_key_algo": "Daimler_Level1",
      "names": {
        "en": "Electronic Transmission Control (722.6 Updated)",
        "de": "Elektronische Getriebesteuerung (722.6 Aktualisiert)",
        "sv": "Elektronisk transmissionsstyrning (722.6 uppdaterad)"
      }
    }
  },
  "parameters": [
    {
      "id": "trans_fluid_temp",
      "name": "Transmission Fluid Temperature",
      "module": "EGS53",
      "service": 34,
      "did": "0x2001",
      "byte_offset": 3,
      "length": 1,
      "scaling": {
        "slope": 1.0,
        "offset": -40.0
      },
      "unit": "°C",
      "min": -40.0,
      "max": 150.0,
      "names": {
        "en": "Transmission Fluid Temperature",
        "de": "Getriebeöltemperatur",
        "sv": "Transmissionsoljetemperatur"
      }
    },
    {
      "id": "tcc_slip_rpm",
      "name": "Torque Converter Clutch Slip",
      "module": "EGS53",
      "service": 34,
      "did": "0x2002",
      "byte_offset": 3,
      "length": 2,
      "scaling": {
        "slope": 1.0,
        "offset": 0.0
      },
      "unit": "RPM",
      "min": 0.0,
      "max": 2000.0,
      "names": {
        "en": "Torque Converter Clutch Slip",
        "de": "Drehzahldifferenz KÜB",
        "sv": "Momentomvandlarkoppling slirning"
      }
    },
    {
      "id": "turbine_speed",
      "name": "Turbine Speed n2",
      "module": "EGS53",
      "service": 34,
      "did": "0x2003",
      "byte_offset": 3,
      "length": 2,
      "scaling": {
        "slope": 1.0,
        "offset": 0.0
      },
      "unit": "RPM",
      "min": 0.0,
      "max": 7000.0,
      "names": {
        "en": "Turbine Speed n2",
        "de": "Turbinendrehzahl n2",
        "sv": "Turbinvarvtal n2"
      }
    },
    {
      "id": "output_speed",
      "name": "Output Shaft Speed n3",
      "module": "EGS53",
      "service": 34,
      "did": "0x2004",
      "byte_offset": 3,
      "length": 2,
      "scaling": {
        "slope": 1.0,
        "offset": 0.0
      },
      "unit": "RPM",
      "min": 0.0,
      "max": 7000.0,
      "names": {
        "en": "Output Shaft Speed n3",
        "de": "Abtriebsdrehzahl n3",
        "sv": "Utgående axelvarvtal n3"
      }
    }
  ]
}
