{
  "profile_name": "mercedes_w211_om646_edc16",
  "oem": "Mercedes-Benz",
  "chassis": "W211/S211",
  "gateway_type": "CGW_N93",
  "default_bitrate": 500000,
  "modules": {
    "EDC16": {
      "name": "Engine Control Unit (Bosch EDC16C31 / OM646 CDI)",
      "tx_id": "0x7E0",
      "rx_id": "0x7E8",
      "protocol": "UDS",
      "seed_key_algo": "Daimler_Level1"
    },
    "EGS52": {
      "name": "Electronic Transmission Control (722.6 5-Speed)",
      "tx_id": "0x7E1",
      "rx_id": "0x7E9",
      "protocol": "KWP2000",
      "seed_key_algo": "Daimler_Level1"
    },
    "CGW": {
      "name": "Central Gateway (N93)",
      "tx_id": "0x7DF",
      "rx_id": "0x7E8",
      "protocol": "UDS",
      "seed_key_algo": "Daimler_Level1"
    },
    "AIRMATIC": {
      "name": "Chassis & Rear Level Control (ENR / Airmatic)",
      "tx_id": "0x7E4",
      "rx_id": "0x7EC",
      "protocol": "KWP2000",
      "seed_key_algo": "Daimler_Level1"
    }
  },
  "parameters": [
    {
      "id": "engine_rpm",
      "name": "Engine Speed",
      "module": "EDC16",
      "service": 34,
      "did": "0x0100",
      "byte_offset": 3,
      "length": 2,
      "scaling": { "slope": 0.25, "offset": 0.0 },
      "unit": "RPM",
      "min": 0.0,
      "max": 5000.0
    },
    {
      "id": "coolant_temp",
      "name": "Engine Coolant Temperature",
      "module": "EDC16",
      "service": 34,
      "did": "0x0105",
      "byte_offset": 3,
      "length": 1,
      "scaling": { "slope": 1.0, "offset": -40.0 },
      "unit": "°C",
      "min": -40.0,
      "max": 140.0
    },
    {
      "id": "rail_pressure",
      "name": "Common Rail Fuel Pressure",
      "module": "EDC16",
      "service": 34,
      "did": "0x200B",
      "byte_offset": 3,
      "length": 2,
      "scaling": { "slope": 0.1, "offset": 0.0 },
      "unit": "bar",
      "min": 0.0,
      "max": 1800.0
    },
    {
      "id": "boost_pressure",
      "name": "Intake Manifold Absolute Pressure (MAP)",
      "module": "EDC16",
      "service": 34,
      "did": "0x2010",
      "byte_offset": 3,
      "length": 2,
      "scaling": { "slope": 1.0, "offset": 0.0 },
      "unit": "hPa",
      "min": 500.0,
      "max": 3000.0
    },
    {
      "id": "inj_corr_cyl1",
      "name": "Cylinder 1 Smooth Running Correction",
      "module": "EDC16",
      "service": 34,
      "did": "0x2021",
      "byte_offset": 3,
      "length": 2,
      "scaling": { "slope": 0.01, "offset": -5.0 },
      "unit": "mm³/stroke",
      "min": -5.0,
      "max": 5.0
    },
    {
      "id": "inj_corr_cyl2",
      "name": "Cylinder 2 Smooth Running Correction",
      "module": "EDC16",
      "service": 34,
      "did": "0x2022",
      "byte_offset": 3,
      "length": 2,
      "scaling": { "slope": 0.01, "offset": -5.0 },
      "unit": "mm³/stroke",
      "min": -5.0,
      "max": 5.0
    },
    {
      "id": "inj_corr_cyl3",
      "name": "Cylinder 3 Smooth Running Correction",
      "module": "EDC16",
      "service": 34,
      "did": "0x2023",
      "byte_offset": 3,
      "length": 2,
      "scaling": { "slope": 0.01, "offset": -5.0 },
      "unit": "mm³/stroke",
      "min": -5.0,
      "max": 5.0
    },
    {
      "id": "inj_corr_cyl4",
      "name": "Cylinder 4 Smooth Running Correction",
      "module": "EDC16",
      "service": 34,
      "did": "0x2024",
      "byte_offset": 3,
      "length": 2,
      "scaling": { "slope": 0.01, "offset": -5.0 },
      "unit": "mm³/stroke",
      "min": -5.0,
      "max": 5.0
    },
    {
      "id": "trans_fluid_temp",
      "name": "Transmission Fluid Temperature",
      "module": "EGS52",
      "service": 34,
      "did": "0x2001",
      "byte_offset": 3,
      "length": 1,
      "scaling": { "slope": 1.0, "offset": -40.0 },
      "unit": "°C",
      "min": -40.0,
      "max": 150.0
    },
    {
      "id": "tcc_slip_rpm",
      "name": "Torque Converter Clutch Slip Speed",
      "module": "EGS52",
      "service": 34,
      "did": "0x2002",
      "byte_offset": 3,
      "length": 2,
      "scaling": { "slope": 1.0, "offset": 0.0 },
      "unit": "RPM",
      "min": 0.0,
      "max": 2000.0
    },
    {
      "id": "turbine_n2_speed",
      "name": "Transmission N2 Turbine Speed",
      "module": "EGS52",
      "service": 34,
      "did": "0x2003",
      "byte_offset": 3,
      "length": 2,
      "scaling": { "slope": 1.0, "offset": 0.0 },
      "unit": "RPM",
      "min": 0.0,
      "max": 7000.0
    },
    {
      "id": "airmatic_height_mv",
      "name": "Rear Axle Ride Height Sensor",
      "module": "AIRMATIC",
      "service": 34,
      "did": "0x2050",
      "byte_offset": 3,
      "length": 2,
      "scaling": { "slope": 1.0, "offset": 0.0 },
      "unit": "mV",
      "min": 1000.0,
      "max": 4000.0
    },
    {
      "id": "airmatic_pressure_bar",
      "name": "Air Suspension Central Reservoir Pressure",
      "module": "AIRMATIC",
      "service": 34,
      "did": "0x2051",
      "byte_offset": 3,
      "length": 1,
      "scaling": { "slope": 0.1, "offset": 0.0 },
      "unit": "bar",
      "min": 0.0,
      "max": 20.0
    }
  ]
}

