{
  "profile_name": "mercedes_w463_g500_m113",
  "oem": "Mercedes-Benz",
  "chassis": "W463 (G-Class)",
  "gateway_type": "CGW",
  "default_bitrate": 500000,
  "modules": {
    "ME97": {
      "name": "Engine Control Unit (Bosch ME 9.7 Gasoline)",
      "tx_id": "0x7E0",
      "rx_id": "0x7E8",
      "protocol": "UDS",
      "seed_key_algo": "Daimler_Level1",
      "names": {
        "en": "Engine Control Unit (Bosch ME 9.7 Gasoline)",
        "de": "Motorsteuergerät (Bosch ME 9.7 Benzin)",
        "sv": "Motorstyrenhet (Bosch ME 9.7 bensin)"
      }
    },
    "VGSNAG2": {
      "name": "Fully Integrated Transmission Control (722.9 7G-Tronic)",
      "tx_id": "0x7E1",
      "rx_id": "0x7E9",
      "protocol": "UDS",
      "seed_key_algo": "Daimler_Level1",
      "names": {
        "en": "Fully Integrated Transmission Control (722.9 7G-Tronic)",
        "de": "Vollintegrierte Getriebesteuerung (722.9 7G-Tronic)",
        "sv": "Helintegrerad transmissionsstyrning (722.9 7G-Tronic)"
      }
    }
  },
  "parameters": [
    {
      "id": "engine_rpm",
      "name": "Engine Speed",
      "module": "ME97",
      "service": 34,
      "did": "0x0100",
      "byte_offset": 3,
      "length": 2,
      "scaling": {
        "slope": 0.25,
        "offset": 0.0
      },
      "unit": "RPM",
      "min": 0.0,
      "max": 7000.0,
      "names": {
        "en": "Engine Speed",
        "de": "Motordrehzahl",
        "sv": "Motorvarvtal"
      }
    },
    {
      "id": "coolant_temp",
      "name": "Engine Coolant Temperature",
      "module": "ME97",
      "service": 34,
      "did": "0x0105",
      "byte_offset": 3,
      "length": 1,
      "scaling": {
        "slope": 1.0,
        "offset": -40.0
      },
      "unit": "°C",
      "min": -40.0,
      "max": 140.0,
      "names": {
        "en": "Engine Coolant Temperature",
        "de": "Kühlmitteltemperatur",
        "sv": "Kylarvätsketemperatur"
      }
    },
    {
      "id": "throttle_angle",
      "name": "Throttle Valve Angle",
      "module": "ME97",
      "service": 34,
      "did": "0x0111",
      "byte_offset": 3,
      "length": 1,
      "scaling": {
        "slope": 0.392,
        "offset": 0.0
      },
      "unit": "%",
      "min": 0.0,
      "max": 100.0,
      "names": {
        "en": "Throttle Valve Angle",
        "de": "Drosselklappenwinkel",
        "sv": "Gasspjällsvinkel"
      }
    },
    {
      "id": "mass_air_flow",
      "name": "Mass Air Flow (MAF)",
      "module": "ME97",
      "service": 34,
      "did": "0x0110",
      "byte_offset": 3,
      "length": 2,
      "scaling": {
        "slope": 0.1,
        "offset": 0.0
      },
      "unit": "kg/h",
      "min": 0.0,
      "max": 600.0,
      "names": {
        "en": "Mass Air Flow (MAF)",
        "de": "Luftmassenmesser (LMM)",
        "sv": "Luftmassemätare (LMM)"
      }
    },
    {
      "id": "lambda_b1s1",
      "name": "Lambda Upstream O2 Voltage Bank 1",
      "module": "ME97",
      "service": 34,
      "did": "0x0114",
      "byte_offset": 3,
      "length": 2,
      "scaling": {
        "slope": 0.001,
        "offset": 0.0
      },
      "unit": "V",
      "min": 0.0,
      "max": 1.2,
      "names": {
        "en": "Lambda Upstream O2 Voltage Bank 1",
        "de": "Lambdaspannung Bank 1 vor Kat",
        "sv": "Lambdaspänning bank 1 före katalysator"
      }
    },
    {
      "id": "lambda_b2s1",
      "name": "Lambda Upstream O2 Voltage Bank 2",
      "module": "ME97",
      "service": 34,
      "did": "0x0115",
      "byte_offset": 3,
      "length": 2,
      "scaling": {
        "slope": 0.001,
        "offset": 0.0
      },
      "unit": "V",
      "min": 0.0,
      "max": 1.2,
      "names": {
        "en": "Lambda Upstream O2 Voltage Bank 2",
        "de": "Lambdaspannung Bank 2 vor Kat",
        "sv": "Lambdaspänning bank 2 före katalysator"
      }
    },
    {
      "id": "trans_fluid_temp",
      "name": "Transmission Fluid Temperature",
      "module": "VGSNAG2",
      "service": 34,
      "did": "0x2001",
      "byte_offset": 3,
      "length": 1,
      "scaling": {
        "slope": 1.0,
        "offset": -40.0
      },
      "unit": "°C",
      "min": -40.0,
      "max": 150.0,
      "names": {
        "en": "Transmission Fluid Temperature",
        "de": "Getriebeöltemperatur",
        "sv": "Transmissionsoljetemperatur"
      }
    },
    {
      "id": "tcc_slip_rpm",
      "name": "Torque Converter Clutch Slip",
      "module": "VGSNAG2",
      "service": 34,
      "did": "0x2002",
      "byte_offset": 3,
      "length": 2,
      "scaling": {
        "slope": 1.0,
        "offset": 0.0
      },
      "unit": "RPM",
      "min": 0.0,
      "max": 2000.0,
      "names": {
        "en": "Torque Converter Clutch Slip",
        "de": "Drehzahldifferenz KÜB",
        "sv": "Momentomvandlarkoppling slirning"
      }
    },
    {
      "id": "turbine_speed",
      "name": "Turbine Speed n2",
      "module": "VGSNAG2",
      "service": 34,
      "did": "0x2003",
      "byte_offset": 3,
      "length": 2,
      "scaling": {
        "slope": 1.0,
        "offset": 0.0
      },
      "unit": "RPM",
      "min": 0.0,
      "max": 7000.0,
      "names": {
        "en": "Turbine Speed n2",
        "de": "Turbinendrehzahl n2",
        "sv": "Turbinvarvtal n2"
      }
    },
    {
      "id": "output_speed",
      "name": "Output Shaft Speed n3",
      "module": "VGSNAG2",
      "service": 34,
      "did": "0x2004",
      "byte_offset": 3,
      "length": 2,
      "scaling": {
        "slope": 1.0,
        "offset": 0.0
      },
      "unit": "RPM",
      "min": 0.0,
      "max": 7000.0,
      "names": {
        "en": "Output Shaft Speed n3",
        "de": "Abtriebsdrehzahl n3",
        "sv": "Utgående axelvarvtal n3"
      }
    }
  ]
}
