{
  "profile_name": "mercedes_w221_m273_me97",
  "oem": "Mercedes-Benz",
  "chassis": "W221",
  "gateway_type": "CGW",
  "default_bitrate": 500000,
  "modules": {
    "ME97": {
      "name": "Engine Control Unit (M272/M273 V6/V8 Gasoline / ME 9.7)",
      "tx_id": "0x7E0",
      "rx_id": "0x7E8",
      "protocol": "UDS",
      "seed_key_algo": "Daimler_Level1"
    },
    "VGSNAG2": {
      "name": "Fully Integrated Transmission Control (722.9 7G-Tronic)",
      "tx_id": "0x7E1",
      "rx_id": "0x7E9",
      "protocol": "UDS",
      "seed_key_algo": "Daimler_Level1"
    }
  },
  "parameters": [
    {
      "id": "engine_rpm",
      "name": "Engine Speed (Motordrehzahl)",
      "module": "ME97",
      "service": 34,
      "did": "0x0100",
      "byte_offset": 3,
      "length": 2,
      "scaling": {
        "slope": 0.25,
        "offset": 0.0
      },
      "unit": "RPM",
      "min": 0.0,
      "max": 7000.0
    },
    {
      "id": "coolant_temp",
      "name": "Coolant Temperature (Kuehlmitteltemperatur)",
      "module": "ME97",
      "service": 34,
      "did": "0x0105",
      "byte_offset": 3,
      "length": 1,
      "scaling": {
        "slope": 1.0,
        "offset": -40.0
      },
      "unit": "\u00b0C",
      "min": -40.0,
      "max": 140.0
    },
    {
      "id": "throttle_angle",
      "name": "Throttle Valve Angle (Drosselklappenwinkel)",
      "module": "ME97",
      "service": 34,
      "did": "0x0111",
      "byte_offset": 3,
      "length": 1,
      "scaling": {
        "slope": 0.392,
        "offset": 0.0
      },
      "unit": "%",
      "min": 0.0,
      "max": 100.0
    },
    {
      "id": "mass_air_flow",
      "name": "Mass Air Flow MAF (Luftmasse kg/h)",
      "module": "ME97",
      "service": 34,
      "did": "0x0110",
      "byte_offset": 3,
      "length": 2,
      "scaling": {
        "slope": 0.1,
        "offset": 0.0
      },
      "unit": "kg/h",
      "min": 0.0,
      "max": 600.0
    },
    {
      "id": "lambda_b1s1",
      "name": "Lambda Upstream O2 Voltage Bank 1",
      "module": "ME97",
      "service": 34,
      "did": "0x0114",
      "byte_offset": 3,
      "length": 2,
      "scaling": {
        "slope": 0.001,
        "offset": 0.0
      },
      "unit": "V",
      "min": 0.0,
      "max": 1.2
    },
    {
      "id": "lambda_b2s1",
      "name": "Lambda Upstream O2 Voltage Bank 2",
      "module": "ME97",
      "service": 34,
      "did": "0x0115",
      "byte_offset": 3,
      "length": 2,
      "scaling": {
        "slope": 0.001,
        "offset": 0.0
      },
      "unit": "V",
      "min": 0.0,
      "max": 1.2
    },
    {
      "id": "trans_fluid_temp",
      "name": "Transmission Fluid Temperature (Getriebeoeltemperatur)",
      "module": "VGSNAG2",
      "service": 34,
      "did": "0x2001",
      "byte_offset": 3,
      "length": 1,
      "scaling": {
        "slope": 1.0,
        "offset": -40.0
      },
      "unit": "\u00b0C",
      "min": -40.0,
      "max": 150.0
    },
    {
      "id": "tcc_slip_rpm",
      "name": "Torque Converter Clutch Slip (Drehzahldifferenz Kueb)",
      "module": "VGSNAG2",
      "service": 34,
      "did": "0x2002",
      "byte_offset": 3,
      "length": 2,
      "scaling": {
        "slope": 1.0,
        "offset": 0.0
      },
      "unit": "RPM",
      "min": 0.0,
      "max": 2000.0
    },
    {
      "id": "turbine_speed",
      "name": "Turbine Speed n2 (Turbinendrehzahl)",
      "module": "VGSNAG2",
      "service": 34,
      "did": "0x2003",
      "byte_offset": 3,
      "length": 2,
      "scaling": {
        "slope": 1.0,
        "offset": 0.0
      },
      "unit": "RPM",
      "min": 0.0,
      "max": 7000.0
    },
    {
      "id": "output_speed",
      "name": "Output Shaft Speed n3 (Abtriebsdrehzahl)",
      "module": "VGSNAG2",
      "service": 34,
      "did": "0x2004",
      "byte_offset": 3,
      "length": 2,
      "scaling": {
        "slope": 1.0,
        "offset": 0.0
      },
      "unit": "RPM",
      "min": 0.0,
      "max": 7000.0
    }
  ]
}