{
  "profile_name": "bmw_e90_m57_dde6",
  "oem": "BMW",
  "chassis": "E90/E91/E92",
  "gateway_type": "JBE_K_CAN",
  "default_bitrate": 500000,
  "modules": {
    "DDE6": {
      "name": "Digital Diesel Electronics (BMW DDE6 / M57)",
      "tx_id": "0x6F1",
      "rx_id": "0x612",
      "protocol": "KWP2000",
      "seed_key_algo": "BMW_KWP_Level1",
      "names": {
        "en": "Digital Diesel Electronics (BMW DDE6 / M57)",
        "de": "Digitale Dieselelektronik (BMW DDE6 / M57)",
        "sv": "Digital dieselelektronik (BMW DDE6 / M57)"
      }
    },
    "EGS_6HP": {
      "name": "ZF 6HP Transmission Control",
      "tx_id": "0x6F1",
      "rx_id": "0x618",
      "protocol": "UDS",
      "seed_key_algo": "BMW_UDS_Level1",
      "names": {
        "en": "ZF 6HP Transmission Control",
        "de": "ZF 6HP Getriebesteuerung",
        "sv": "ZF 6HP transmissionsstyrning"
      }
    }
  },
  "parameters": [
    {
      "id": "engine_rpm",
      "name": "Engine Speed",
      "module": "DDE6",
      "service": 34,
      "did": "0x1000",
      "byte_offset": 3,
      "length": 2,
      "scaling": {
        "slope": 1.0,
        "offset": 0.0
      },
      "unit": "RPM",
      "min": 0.0,
      "max": 5000.0,
      "names": {
        "en": "Engine Speed",
        "de": "Motordrehzahl",
        "sv": "Motorvarvtal"
      }
    },
    {
      "id": "zf_oil_temp",
      "name": "ZF Transmission Sump Temperature",
      "module": "EGS_6HP",
      "service": 34,
      "did": "0x2001",
      "byte_offset": 3,
      "length": 1,
      "scaling": {
        "slope": 1.0,
        "offset": -50.0
      },
      "unit": "°C",
      "min": -50.0,
      "max": 150.0,
      "names": {
        "en": "ZF Transmission Sump Temperature",
        "de": "ZF Getriebeöltemperatur",
        "sv": "ZF växellådsoljetemperatur"
      }
    }
  ]
}
