{
  "profile_name": "mercedes_w164_om642_cr4",
  "oem": "Mercedes-Benz",
  "chassis": "W164/X164/W251",
  "gateway_type": "CGW",
  "default_bitrate": 500000,
  "modules": {
    "CR4": {
      "name": "Engine Control Unit (OM642 V6 CDI 4 / EDC16CP31)",
      "tx_id": "0x7E0",
      "rx_id": "0x7E8",
      "protocol": "UDS",
      "seed_key_algo": "Daimler_Level1"
    },
    "VGSNAG2": {
      "name": "Fully Integrated Transmission Control (722.9 7G-Tronic)",
      "tx_id": "0x7E1",
      "rx_id": "0x7E9",
      "protocol": "UDS",
      "seed_key_algo": "Daimler_Level1"
    }
  },
  "parameters": [
    {
      "id": "engine_rpm",
      "name": "Engine Speed (Motordrehzahl)",
      "module": "CR4",
      "service": 34,
      "did": "0x0100",
      "byte_offset": 3,
      "length": 2,
      "scaling": {
        "slope": 0.25,
        "offset": 0.0
      },
      "unit": "RPM",
      "min": 0.0,
      "max": 5000.0
    },
    {
      "id": "coolant_temp",
      "name": "Coolant Temperature (Kuehlmitteltemperatur)",
      "module": "CR4",
      "service": 34,
      "did": "0x0105",
      "byte_offset": 3,
      "length": 1,
      "scaling": {
        "slope": 1.0,
        "offset": -40.0
      },
      "unit": "\u00b0C",
      "min": -40.0,
      "max": 140.0
    },
    {
      "id": "rail_pressure",
      "name": "Common Rail Pressure (Raildruck Istwert)",
      "module": "CR4",
      "service": 34,
      "did": "0x200B",
      "byte_offset": 3,
      "length": 2,
      "scaling": {
        "slope": 0.1,
        "offset": 0.0
      },
      "unit": "bar",
      "min": 0.0,
      "max": 1800.0
    },
    {
      "id": "boost_pressure",
      "name": "Boost Pressure (Ladedruck Istwert)",
      "module": "CR4",
      "service": 34,
      "did": "0x2010",
      "byte_offset": 3,
      "length": 2,
      "scaling": {
        "slope": 1.0,
        "offset": 0.0
      },
      "unit": "hPa",
      "min": 500.0,
      "max": 3000.0
    },
    {
      "id": "air_mass",
      "name": "Air Mass Flow (Luftmasse Soll/Ist)",
      "module": "CR4",
      "service": 34,
      "did": "0x2015",
      "byte_offset": 3,
      "length": 2,
      "scaling": {
        "slope": 0.1,
        "offset": 0.0
      },
      "unit": "mg/hub",
      "min": 0.0,
      "max": 1200.0
    },
    {
      "id": "inj_corr_cyl1",
      "name": "Smooth Running Correction Cyl 1 (Laufruheregler Zyl 1)",
      "module": "CR4",
      "service": 34,
      "did": "0x2021",
      "byte_offset": 3,
      "length": 2,
      "scaling": {
        "slope": 0.01,
        "offset": -5.0
      },
      "unit": "mm\u00b3/stroke",
      "min": -5.0,
      "max": 5.0
    },
    {
      "id": "inj_corr_cyl2",
      "name": "Smooth Running Correction Cyl 2 (Laufruheregler Zyl 2)",
      "module": "CR4",
      "service": 34,
      "did": "0x2022",
      "byte_offset": 3,
      "length": 2,
      "scaling": {
        "slope": 0.01,
        "offset": -5.0
      },
      "unit": "mm\u00b3/stroke",
      "min": -5.0,
      "max": 5.0
    },
    {
      "id": "inj_corr_cyl3",
      "name": "Smooth Running Correction Cyl 3 (Laufruheregler Zyl 3)",
      "module": "CR4",
      "service": 34,
      "did": "0x2023",
      "byte_offset": 3,
      "length": 2,
      "scaling": {
        "slope": 0.01,
        "offset": -5.0
      },
      "unit": "mm\u00b3/stroke",
      "min": -5.0,
      "max": 5.0
    },
    {
      "id": "inj_corr_cyl4",
      "name": "Smooth Running Correction Cyl 4 (Laufruheregler Zyl 4)",
      "module": "CR4",
      "service": 34,
      "did": "0x2024",
      "byte_offset": 3,
      "length": 2,
      "scaling": {
        "slope": 0.01,
        "offset": -5.0
      },
      "unit": "mm\u00b3/stroke",
      "min": -5.0,
      "max": 5.0
    },
    {
      "id": "inj_corr_cyl5",
      "name": "Smooth Running Correction Cyl 5 (Laufruheregler Zyl 5)",
      "module": "CR4",
      "service": 34,
      "did": "0x2025",
      "byte_offset": 3,
      "length": 2,
      "scaling": {
        "slope": 0.01,
        "offset": -5.0
      },
      "unit": "mm\u00b3/stroke",
      "min": -5.0,
      "max": 5.0
    },
    {
      "id": "inj_corr_cyl6",
      "name": "Smooth Running Correction Cyl 6 (Laufruheregler Zyl 6)",
      "module": "CR4",
      "service": 34,
      "did": "0x2026",
      "byte_offset": 3,
      "length": 2,
      "scaling": {
        "slope": 0.01,
        "offset": -5.0
      },
      "unit": "mm\u00b3/stroke",
      "min": -5.0,
      "max": 5.0
    },
    {
      "id": "trans_fluid_temp",
      "name": "Transmission Fluid Temperature (Getriebeoeltemperatur)",
      "module": "VGSNAG2",
      "service": 34,
      "did": "0x2001",
      "byte_offset": 3,
      "length": 1,
      "scaling": {
        "slope": 1.0,
        "offset": -40.0
      },
      "unit": "\u00b0C",
      "min": -40.0,
      "max": 150.0
    },
    {
      "id": "tcc_slip_rpm",
      "name": "Torque Converter Clutch Slip (Drehzahldifferenz Kueb)",
      "module": "VGSNAG2",
      "service": 34,
      "did": "0x2002",
      "byte_offset": 3,
      "length": 2,
      "scaling": {
        "slope": 1.0,
        "offset": 0.0
      },
      "unit": "RPM",
      "min": 0.0,
      "max": 2000.0
    },
    {
      "id": "turbine_speed",
      "name": "Turbine Speed n2 (Turbinendrehzahl)",
      "module": "VGSNAG2",
      "service": 34,
      "did": "0x2003",
      "byte_offset": 3,
      "length": 2,
      "scaling": {
        "slope": 1.0,
        "offset": 0.0
      },
      "unit": "RPM",
      "min": 0.0,
      "max": 7000.0
    },
    {
      "id": "output_speed",
      "name": "Output Shaft Speed n3 (Abtriebsdrehzahl)",
      "module": "VGSNAG2",
      "service": 34,
      "did": "0x2004",
      "byte_offset": 3,
      "length": 2,
      "scaling": {
        "slope": 1.0,
        "offset": 0.0
      },
      "unit": "RPM",
      "min": 0.0,
      "max": 7000.0
    }
  ]
}