{
  "profile_name": "vag_golf_mk6_edc17",
  "oem": "Volkswagen AG",
  "chassis": "Golf Mk6 (PQ35)",
  "gateway_type": "CAN_Gateway_1K0",
  "default_bitrate": 500000,
  "modules": {
    "EDC17": {
      "name": "Engine Control Unit (Bosch EDC17C46 2.0 TDI)",
      "tx_id": "0x7E0",
      "rx_id": "0x7E8",
      "protocol": "UDS",
      "seed_key_algo": "VAG_UDS_Level1"
    },
    "DSG_DQ250": {
      "name": "Direct Shift Gearbox 6-Speed (DQ250)",
      "tx_id": "0x7E1",
      "rx_id": "0x7E9",
      "protocol": "UDS",
      "seed_key_algo": "VAG_UDS_Level1"
    }
  },
  "parameters": [
    {
      "id": "engine_rpm",
      "name": "Engine RPM",
      "module": "EDC17",
      "service": 34,
      "did": "0xF40C",
      "byte_offset": 3,
      "length": 2,
      "scaling": { "slope": 0.25, "offset": 0.0 },
      "unit": "RPM",
      "min": 0.0,
      "max": 5500.0
    },
    {
      "id": "dsg_clutch_temp",
      "name": "DSG Dual Clutch Oil Temperature",
      "module": "DSG_DQ250",
      "service": 34,
      "did": "0x1A05",
      "byte_offset": 3,
      "length": 1,
      "scaling": { "slope": 1.0, "offset": -40.0 },
      "unit": "°C",
      "min": -40.0,
      "max": 160.0
    }
  ]
}

